question_english,disease_english,drug_english,treatment_english,question_hindi,disease_hindi,drug_hindi,treatment_hindi,question_bengali,disease_bengali,drug_bengali,treatment_bengali,question_tamil,disease_tamil,drug_tamil,treatment_tamil,question_telugu,disease_telugu,drug_telugu,treatment_telugu,question_marathi,disease_marathi,drug_marathi,treatment_marathi,question_gujarati,disease_gujarati,drug_gujarati,treatment_gujarati,Manual_Intent
i had my uterus removed can i still get cervical cancer,Cervical cancer,,uterus removed,मैंने अपना गर्भाशय निकाल दिया था क्या मुझे अब भी सर्वाइकल कैंसर हो सकता है?,सर्वाइकल कैंसर,,गर्भाशय निकाला गया,আমি তো আমার জরায়ু অপসারণ করেছি আমি কি এখনও জরায়ুর ক্যান্সার পেতে পারি,জরায়ুর ক্যান্সার,,জরায়ু অপসারণ,"நான் என் கருப்பை அகற்றப்பட்டேன், நான் இன்னும் கர்ப்பப்பை வாய்ப் புற்றுநோயைப் பெற முடியுமா?",புற்றுநோயை,,கருப்பை அகற்றப்பட்டேன்,"నేను నా గర్భాశయాన్ని తొలగించుకున్నాను, నాకు ఇంకా గర్భాశయ క్యాన్సర్ వస్తుందా?",గర్భాశయ క్యాన్సర్,,గర్భాశయాన్ని తొలగించు,मी माझे गर्भाशय काढले होते मला अजूनही गर्भाशयाचा कर्करोग होऊ शकतो का?,गर्भाशयाचा कर्करोग,,गर्भाशय काढ,"મેં મારું ગર્ભાશય કાઢી નાખ્યું હતું, શું મને હજુ પણ સર્વાઇકલ કેન્સર થઈ શકે છે",સર્વાઇકલ કેન્સર,,,disease
can taking certain perscription or otc drugs/supplements cause a loss of penile sensation,penile sensation,"OTC Drugs, supplements",,क्या कुछ नुस्खे या ओटीसी दवाएं/सप्लीमेंट्स लेने से पेनाइल संवेदना का नुकसान हो सकता है,पेनाइल संवेदना,"ओटीसी ड्रग्स, सप्लीमेंट्स",,নির্দিষ্ট পারক্রিপশন বা ওটিসি ওষুধ/পরিপূরক গ্রহণ করলে পুরুষাঙ্গের সংবেদন নষ্ট হতে পারে?,পুরুষাঙ্গের সংবেদন নষ্ট,"ওটিসি ওষুধ, পরিপূরক",,சில தடுப்பு அல்லது ஓடிசி மருந்துகள்/கூடுதல் மருந்துகளை உட்கொள்வது ஆண்குறி உணர்வை இழக்க நேரிடுமா?, ஆண்குறி உணர்வை,"ஓடிசி மருந்துகள், கூடுதல் மருந்துகளை",,నిర్దిష్ట నిర్దేశిత లేదా ఓటీసీ  మందులు/సప్లిమెంట్‌లను తీసుకోవడం వల్ల పురుషాంగ సంచలనాన్ని కోల్పోవచ్చ?,పురుషాంగ సంచలనాన్ని,"ఓటీసీ  మందులు, సప్లిమెంట్‌లు",,ठराविक पर्स्क्रिप्शन किंवा ओटीसी ड्रग्स/सप्लिमेंट्स घेतल्याने लिंग संवेदना नष्ट होऊ शकतात,लिंग संवेदना,"ओटीसी ड्रग्स,सप्लिमेंट्स",,ચોક્કસ પર્ક્રિપ્શન અથવા ઓટીસી દવાઓ/પૂર્તિઓ લેવાથી શિશ્નની સંવેદનામાં ઘટાડો થઈ શકે છે,શિશ્ન સંવેદના,"ઓટીસી દવાઓ, પૂરક",,disease
can you take a stool softner if you have diverticulitis?,diverticulitis,stool softner,,यदि आपको विपुटीशोथ है तो क्या आप मल सॉफ़्नर ले सकते हैं?,विपुटीशोथ,स्टूल सॉफ़्टनर,,আপনার যদি ডাইভার্টিকুলাইটিস থাকে তবে আপনি কি একটি মল সফটনার নিতে পারেন?,ডাইভার্টিকুলাইটিস,মল সফটনার,,உங்களிடம் டைவர்டிகுலிடிஸ் இருந்தால் மலம் மென்மையாக இருக்க முடியுமா?,டைவர்டிகுலிடிஸ்,மலம் மென்மையாக,,మీకు డైవర్టికులిటిస్ ఉన్నట్లయితే మీరు స్టూల్ సాఫ్ట్‌నర్‌ ను తీసుకోవచ్చా?,డైవర్టికులిటిస్,స్టూల్ సాఫ్ట్‌నర్‌,,तुम्हाला डायव्हर्टिकुलिटिस असल्यास तुम्ही स्टूल सॉफ्टनर घेऊ शकता का?,डायव्हर्टिकुलिटिस,स्टूल सॉफ्टनर,,જો તમને ડાયવર્ટિક્યુલાટીસ હોય તો શું તમે સ્ટૂલ સોફ્ટનર લઈ શકો છો?,ડાયવર્ટિક્યુલાટીસ,સ્ટૂલ સોફ્ટનર,,disease
will cipro help with sinus infection and respitory,sinus infection,cipro,,क्या सिप्रो साइनस संक्रमण और श्वसन में मदद करेगा?,साइनस संक्रमण,सिप्रो,,সিপ্রো সাইনাস সংক্রমণ এবং শ্বাসপ্রশ্বাসের সাথে সহায়তা করবে?,সাইনাস সংক্রমণ,সিপ্রো,,சைனஸ் தொற்று மற்றும் பேருக்கு சிப்ரோ உதவுமா?,சைனஸ் தொற்று,சிப்ரோ,,"సైనస్ ఇన్ఫెక్షన్ మరియు రెస్పిటరీకి, సిప్రో సహాయపడుతుందా?",సైనస్ ఇన్ఫెక్షన్,సిప్రో,,सायप्रो सायनस संसर्ग आणि श्वासोच्छवासास मदत करेल,सायनस संसर्ग,सायप्रो,,સિપ્રો સાઇનસ ચેપ અને શ્વસનતંત્રમાં મદદ કરશે,સાઇનસ ચેપ,સિપ્રો,,disease
is there a vitamin to help prevent boils?,boils,vitamin,,क्या फोड़े को रोकने में मदद करने के लिए एक विटामिन है?,फोड़े,विटामिन ,,ফোঁড়া প্রতিরোধে সহায়তা করার জন্য কি কোনও ভিটামিন আছে?,ফোঁড়া,ভিটামিন,,கொப்புளங்களைத் தடுக்க உதவும் வைட்டமின் உள்ளதா?,கொப்புளங்களைத் ,வைட்டமின் ,,బొబ్బలను నివారించడంలో సహాయపడటానికి విటమిన్ ఉందా?,బొబ్బలు,విటమిన్,,गळू टाळण्यासाठी जीवनसत्व आहे का?,गळू,जीवनसत्व,,શું ઉકળે રોકવામાં મદદ કરવા માટે વિટામિન છે?,ઉકળે,વિટામિન,,disease
what is nystatin prescribed for?,,nystatin,,निस्टेटिन किस लिए निर्धारित किया गया है?,,निस्टेटिन,,নিস্টাটিন কি জন্য নির্ধারিত হয়?,,নিস্টাটিন,,நிஸ்டாடின் எதற்காக பரிந்துரைக்கப்படுகிறது?,,நிஸ்டாடின்,,నిస్టాటిన్ దేని కొరకు సిఫారసు చేయబడుతుంది?,,నిస్టాటిన్,,नायस्टाटिन कशासाठी लिहून दिले जाते?,,नायस्टाटिन,,નિસ્ટાટિન શું માટે સૂચવવામાં આવે છે?,,નિસ્ટાટિન,,drug
is it safe to take emergen-c while pregnant?,,emergen-c,,क्या गर्भवती होने पर एमर्जेन-सी लेना सुरक्षित है?,,एमर्जेन-सी,,গর্ভবতী থাকাকালীন ইমার্জেন-সি গ্রহণ করা কি নিরাপদ?,,ইমার্জেন-সি,,கர்ப்பமாக இருக்கும்போது எமர்ஜென்-சி எடுப்பது பாதுகாப்பானதா?,,எமர்ஜென்-சி,,గర్భవతిగా ఉన్నప్పుడు ఎమర్జెన్-సి తీసుకోవడం సురక్షితమేనా?,,ఎమర్జెన్-సి,,गर्भावस्थेत इमरजेन-सी   घेणे सुरक्षित आहे का?,,इमरजेन-सी  ,,શું ગર્ભાવસ્થા દરમિયાન ઇમર્જન-સી લેવું સુરક્ષિત છે?,,ઇમર્જન-સી,,drug
could taking valium result in a false positive on a pregnancy test?,,Valium,pregnency test,एक गर्भावस्था परीक्षण पर एक झूठी सकारात्मक में वैलियम परिणाम हो सकता है?,,वैलियम,गर्भावस्था परीक्षण,ভ্যালিয়াম গ্রহণ করার কারণে কি গর্ভাবস্থা্র পরীক্ষায় ফল্‌স পজিটিভ ফল আসতে পারে?,,ভ্যালিয়াম,গর্ভাবস্থা্র পরীক্ষা,வாலியம் எடுத்துக்கொள்வது ஒரு கர்ப்ப பரிசோதனையில் தவறான நேர்மறையான விளைவை ஏற்படுத்துமா?,,வாலியம் ,கர்ப்ப பரிசோதனையில்,వాలియం తీసుకోవడం వల్ల గర్భధారణ పరీక్షలో తప్పుడు పాజిటివ్ వస్తుందా?,,వాలియం,గర్భధారణ పరీక్ష,व्हॅलियम घेतल्याने गर्भधारणा चाचणीत चुकीचा परिणाम होऊ शकतो?,,व्हॅलियम,गर्भधारणा चाचणी,શું વેલિયમ લેવાથી ગર્ભાવસ્થા પરિક્ષણમાં ખોટા હકારાત્મક પરિણામ આવી શકે છે?,,વેલિયમ,ગર્ભાવસ્થા પરિક્ષણ,drug
is creon fda approved and covered by most insurance?,,creon,,क्रेऑन एफडीए अनुमोदित है और ज़्यादातर बिमाओं द्वारा कवर किया गया है?,,क्रेऑन,,ক্রিয়ন কি এফডিএ অনুমোদিত এবং অধিকাংশ বীমার আওতায় আসে?,,ক্রিয়ন,,கிரியோன் எஃப்.டி.ஏ அங்கீகரிக்கப்பட்டு பெரும்பாலான காப்பீட்டால் மூடப்பட்டதா?,,கிரியோன்,,"క్రియోన్ ఎఫ్ డిఎ ఆమోదించబడి, చాలా బీమాల ద్వారా కవర్ చేయబడిందా?",,క్రియోన్ ఎఫ్,,क्रेयोन एफडीए  मंजूर आहे का  आणि बहुतेक विम्याद्वारे संरक्षित आहे?,,क्रेयोन ,,શું ક્રિઓન એફડીએ મંજૂર છે અને મોટાભાગના વીમા દ્વારા આવરી લેવામાં આવે છે?,,ક્રિઓન એફડીએ,,drug
what is antiemetic,,antimatic,,एंटीमैटिक क्या है?,,एंटीमैटिक,,এন্টিএমেটিক কি?,,এন্টিএমেটিক,,ஆண்டிமெடிக் என்றால் என்ன ?,,ஆண்டிமெடிக்,,వాంతి నిరోధకం అంటే ఏమిటి?,,వాంతి నిరోధకం,,अँटीमेटिक काय आहे,,अँटीमेटिक,,એન્ટિમેટિક શું છે,,એન્ટિમેટિક,,drug
what is coreg cr taken for?,,coreg cr,,करेग सी आर किस लिए लिया जाता है?,,करेग सी आर,,কোরেগ সিআর কিসের জন্য নেওয়া হয়?,,কোরেগ সিআর,,கோர்க் சிஆர் எதற்காக எடுக்கப்படுகிறது?,,கோர்க் சிஆர்,,కోర్గ్ సిఆర్ దేనికి తీసుకోబడుతుంది?,,కోర్గ్ సిఆర్,,कॉरेग सी आर  कशासाठी घेतले जाते?,,कॉरेग सी आर ,,કોરેગ સીઆર શું માટે લેવામાં આવે છે?,,કોરેગ સીઆર,,drug
what would a single dose of 4 azithromycin pills be used to treat?,,azithromycin,,क्या चार एज़िथ्रोमाइसिन गोलियों की एक खुराक के इलाज के लिए इस्तेमाल किया जाएगा?,,एज़िथ्रोमाइसिन,,কী চিকিৎসার জন্য 4 টি অ্যাজিথ্রোমাইসিন বড়ির একটি ডোজ ব্যবহার করা হবে?,,অ্যাজিথ্রোমাইসিন,,சிகிச்சையளிக்க 4 அஜித்ரோமைசின் மாத்திரைகளின் ஒற்றை டோஸ் என்ன பயன்படுத்தப்படும்?,,அஜித்ரோமைசின்,,చికిత్స చేయడం కొరకు ౪ అజిత్రోమైసిన్ మాత్రల యొక్క సింగిల్ మోతాదును దేనికి  ఉపయోగిస్తారు?,,అజిత్రోమైసిన్,,उपचारासाठी ४  अजिथ्रोमाइसिन गोळ्यांचा एकच डोस काय वापरला जाईल?,,अजिथ्रोमाइसिन,,સારવાર માટે ૪ એઝિથ્રોમાસીન ગોળીઓની એક માત્રાનો ઉપયોગ શું થશે?,,એઝિથ્રોમાસીન,,drug
is clindamycin effective in treating syphilis?,syphilis,clindamycin,,क्या सिफलिस के इलाज में क्लिंडामाइसिन प्रभावी है?,सिफलिस,क्लिंडामाइसिन,,সিফিলিসের চিকিৎসায় কি ক্লিন্ডামাইসিন কার্যকর?,সিফিলিস,ক্লিন্ডামাইসিন,,சிபிலிஸுக்கு சிகிச்சையளிப்பதில் கிளிண்டமைசின் பயனுள்ளதா?,சிபிலிஸு,கிளிண்டமைசின்,,సిఫిలిస్ చికిత్సలో క్లిండమైసిన్ ప్రభావవంతంగా ఉందా?,సిఫిలిస్,క్లిండమైసిన్,,क्लिंडामायसिन सिफिलीसच्या उपचारात प्रभावी आहे का?,सिफिलीस,क्लिंडामायसिन,,શું ક્લિન્ડામિસિન સિફિલિસની સારવારમાં અસરકારક છે?,સિફિલિસ,ક્લિન્ડામિસિન,,drug
can valtrex be used to treat lichen schlrosis,lichen sclerosus,valtrax,,क्या वाल्ट्रेक्स का उपयोग लाइकेन स्क्लेरोसस के इलाज के लिए किया जा सकता है ?,लाइकेन स्क्लेरोसस,वाल्ट्रेक्स,,লিচেন শ্লোরোসিসের চিকিত্সার জন্য ভাল্ট্রেক্স ব্যবহার করা যেতে পারে?,লিচেন শ্লোরোসিস,ভাল্ট্রেক্স,,லிச்சென் ஸ்க்லரோசிஸுக்கு சிகிச்சையளிக்க வால்ட்ரெக்ஸ் பயன்படுத்தப்படலாம்,லிச்சென் ஸ்க்லரோசிஸுக்கு,வால்ட்ரெக்ஸ் ,,లైకెన్ స్క్రోసిస్ చికిత్సకు వాల్ట్రెక్స్ ను ఉపయోగించవచ్చా?,లైకెన్ స్క్రోసిస్,వాల్ట్రెక్స్,,व्हॅल्ट्रेक्सचा उपयोग लाइकेन श्लेरोसिसवर उपचार करण्यासाठी केला जाऊ शकतो,लाइकेन श्लेरोसिस,व्हॅल्ट्रेक्स,,વાલટ્રેક્સનો ઉપયોગ લિકેન સ્ક્લરોસિસની સારવાર માટે થઈ શકે છે,લિકેન સ્ક્લેરોસસ,વાલ્ટ્રેક્સ,,drug
can lisinopril affect home pregnancy test results?,,lisinopril,home pregnency test,क्या लिसिनोप्रिल घरेलू गर्भावस्था परीक्षण के परिणामों को प्रभावित कर सकता है?,,लिसिनोप्रिल,घर गर्भावस्था परीक्षण,লিসিনোপ্রিল কি হোম গর্ভাবস্থা পরীক্ষার ফলাফল প্রভাবিত করতে পারে?,,লিসিনোপ্রিল,হোম গর্ভাবস্থা পরীক্ষা,லிசினோபிரில் வீட்டு கர்ப்ப சோதனை முடிவுகளை பாதிக்க முடியுமா?,,லிசினோபிரில்,வீட்டு கர்ப்ப சோதனை,లిసినోప్రిల్ ఇంటి గర్భధారణ పరీక్ష ఫలితాలను ప్రభావితం చేయగలదా?,,లిసినోప్రిల్,గర్భధారణ పరీక్ష,लिसिनोप्रिल घरगुती गर्भधारणा चाचणी परिणामांवर परिणाम करू शकते?,,लिसिनोप्रिल,गर्भधारणा चाचणी,શું લિસિનોપ્રિલ હોમ ગર્ભાવસ્થા પરિક્ષણના પરિણામોને અસર કરી શકે છે?,,લિસિનોપ્રિલ,ગર્ભાવસ્થા પરિક્ષણ,drug
can douching after sex stop me from getting pregnant?,pregnant,,,क्या सम्भोग के बाद डाउचिंग मुझे गर्भवती होने से रोक सकता हैं?,गर्भवती,,,সেক্সের পরে ডাউচিং কি আমাকে গর্ভবতী হওয়া থেকে বিরত রাখতে পারে?,গর্ভবতী,,,உடலுறவுக்குப் பிறகு டச்சிங் செய்வதால் நான் கர்ப்பமாவதைத் தடுக்க முடியுமா?,கர்ப்பமாவதைத்,,,రతి తరువాత పిచికారీ చేయడం నన్ను గర్భవతిని చేయకుండా ఆపగలదా?,గర్భవతి,,,सेक्स नंतर डोचिंग केल्याने मला गरोदर होण्यापासून थांबता येते का?,,,,શું સેક્સ પછી ડચિંગ મને ગર્ભવતી થવાથી રોકી શકે છે?,,,,other
at what age do children begin to get their adult teeth?,,,,किस उम्र में बच्चों को अपने वयस्क दांत मिलना शुरू हो जाते हैं?,,,,কোন বয়সে বাচ্চারা তাদের পূর্ণবয়স্ক দাঁত পেতে শুরু করে?,,,,எந்த வயதில் குழந்தைகள் தங்கள் வயதுவந்த பற்களைப் பெறத் தொடங்குகிறார்கள்?,,,,పిల్లలు ఏ వయస్సులో తమ వయోజన దంతాలను పొందడం ప్రారంభిస్తారు?,,,,कोणत्या वयात मुलांना त्यांचे प्रौढ दात येणे सुरू होते?,,,,કઈ ઉંમરે બાળકો તેમના પુખ્ત દાંત મેળવવાનું શરૂ કરે છે?,,,,other
is the risk for heart disease reduced by lowering cholesterol?,"Cholesterol, heart disease",,,क्या कोलेस्ट्रॉल को कम करने से हृदय रोग का खतरा कम हो जाता है?,"कोलेस्ट्रॉल, हृदय रोग",,,কোলেস্টেরল কমানোর মাধ্যমে কি হৃদরোগের ঝুঁকি কমে যায়?,"হৃদরোগের, কোলেস্টেরল",,,கொழுப்பைக் குறைப்பதன் மூலம் இதய நோய்க்கான ஆபத்து குறைக்கப்படுகிறதா?,"கொழுப்பைக், இதய நோய்க்கான",,,కొలెస్ట్రాల్‌ను తగ్గించడం ద్వారా గుండె జబ్బులు వచ్చే ప్రమాదం తగ్గుతుందా?,"కొలెస్ట్రాల్‌, గుండె జబ్బులు",,,कोलेस्टेरॉल कमी केल्याने हृदयविकाराचा धोका कमी होतो का?,"कोलेस्टेरॉल,हृदयविकार",,,શું કોલેસ્ટ્રોલ ઘટાડવાથી હૃદયરોગનું જોખમ ઓછું થાય છે?,"કોલેસ્ટ્રોલ, હૃદય રોગ",,,other
