question_english,disease_english,drug_english,treatment_english,question_hindi,disease_hindi,drug_hindi,treatment_hindi,question_bengali,disease_bengali,drug_bengali,treatment_bengali,question_tamil,disease_tamil,drug_tamil,treatment_tamil,question_telugu,disease_telugu,drug_telugu,treatment_telugu,question_marathi,disease_marathi,drug_marathi,treatment_marathi,question_gujarati,disease_gujarati,drug_gujarati,treatment_gujarati,Manual_Intent
is expired birth control still effective?,,,birth control,क्या एक्सपायर्ड जन्म नियंत्रण अभी भी प्रभावी है?,,,जन्म नियंत्रण,মেয়াদোত্তীর্ণ জন্ম নিয়ন্ত্রণের ওষুধ কি এখনও কার্যকর?,,,জন্ম নিয়ন্ত্রণের ওষুধ,"பிறப்பு கட்டுப்பாடு காலாவதியாகிவிட்டால், அதன் பிறகும் பயன்படுத்துவது பயனுள்ளதாக இருக்குமா?",,,பிறப்பு கட்டுப்பாடு,గడువు తీరిన జనన నియంత్రణ ఇంకా ప్రభావవంతంగా ఉంటుందా ?,,,జనన నియంత్రణ,कालबाह्य झालेले जन्म नियंत्रण अद्याप प्रभावी आहे का?,,,जन्म नियंत्रण,શું સમાપ્ત થયેલ જન્મ નિયંત્રણ હજુ પણ અસરકારક છે?,,,જન્મ નિયંત્રણ,other
can i drink milk or orange juice with sinusitis?,sinusitis,,,क्या मैं साइनसाइटिस के साथ दूध या संतरे का रस पी सकता हूँ?,साइनसाइटिस,,,আমি কি সাইনোসাইটিসের সাথে দুধ বা কমলার রস পান করতে পারি?,সাইনোসাইটিস,,,சைனசிடிஸுடன்  நான் பால் அல்லது ஆரஞ்சு சாறு குடிக்கலாமா?,சைனசிடிஸ்,,,నేను సైనసైటిస్‌తో పాలు లేదా నారింజ రసం తాగవచ్చా?,సైనసైటిస్‌,,,सायनुसायटिस सह मी दूध किंवा संत्र्याचा रस पिऊ शकतो का?,सायनुसायटिस,,,શું હું સાઇનસાઇટિસ સાથે દૂધ અથવા નારંગીનો રસ પી શકું?,સાઇનસાઇટિસ,,,other
does soaking in epsom salts help to draw out excess lactic acid from muscles?,excess lactic acid,epsom salts,,क्या एप्सम लवण में भिगोने से मांसपेशियों से अतिरिक्त लैक्टिक एसिड को बाहर निकालने में मदद मिलती है?,अतिरिक्त लैक्टिक एसिड,एप्सोम नमक,,এপসোম সল্টগুলিতে ভিজিয়ে রাখা কি পেশী থেকে অতিরিক্ত ল্যাকটিক অ্যাসিড বের করতে সহায়তা করে?,অতিরিক্ত ল্যাকটিক অ্যাসিড,এপসোম সল্টগুলিতে,,எப்சம் உப்புகளில் ஊறவைப்பது தசைகளிலிருந்து அதிகப்படியான லாக்டிக் அமிலத்தை வெளியேற்ற உதவுகிறதா?,அதிகப்படியான லாக்டிக் அமிலத்தை,எப்சம் உப்பு,,ఎప్సమ్ లవణాలలో నానబెట్టడం కండరాల నుండి అదనపు లాక్టిక్ ఆమ్లాన్ని బయటకు తీయడంలో సహాయపడుతుందా?,అదనపు లాక్టిక్ ఆమ్లా,ఎప్సమ్ లవణాలు,,एप्सम क्षारांमध्ये भिजल्याने स्नायूंमधून अतिरिक्त लॅक्टिक ऍसिड बाहेर काढण्यास मदत होते का?,अतिरिक्त लॅक्टिक ऍसिड,एप्सम क्षार,,શું એપ્સમ ક્ષારમાં પલાળવાથી સ્નાયુઓમાંથી વધારાનું લેક્ટિક એસિડ બહાર કાઢવામાં મદદ મળે છે?,,એપ્સમ ક્ષાર,,other
can saline solution be used in nostrils while there is greenish discharge?,greenish discharge,saline solution,,हरे रंग का स्राव होने पर क्या नथुने में नमकीन घोल का उपयोग किया जा सकता है?,हरा-भरा निर्वहन,नमकीन घोल,,সবুজ স্রাব থাকলে কি নাকের ডগায় স্যালাইন দ্রবণ ব্যবহার করা যেতে পারে?,সবুজ স্রাব,নাকের ডগায় স্যালাইন,,பச்சை நிற நீர் வெளியேற்றம் இருக்கும்போது மூக்கில் உப்புக் கரைசலை பயன்படுத்த முடியுமா?,பச்சை நிற நீர் வெளியேற்றம்,உப்புக் கரைசலை,,ఆకుపచ్చని ఉత్సర్గ ఉన్నప్పుడు సెలైన్ ద్రావణాన్ని నాసికా రంధ్రాల్లో ఉపయోగించవచ్చా?,ఆకుపచ్చని ఉత్సర్గ,సెలైన్ ద్రావణం,,हिरवट स्त्राव असताना नाकपुड्यात खारट द्रावण वापरता येईल का?,हिरवट स्त्राव,खारट द्रावण,,જ્યારે લીલોતરી સ્રાવ હોય ત્યારે શું નસકોરામાં ખારા દ્રાવણનો ઉપયોગ કરી શકાય?,લીલોતરી સ્રાવ,ખારા ઉકેલ,,other
is kidney dialysis covered by medicare?,,,dialysis,क्या किडनी डायलिसिस मेडिकेयर द्वारा कवर किया जाता है?,,,डायलिसिस,মেডিকেয়ার কি কিডনি ডায়ালিসিস কভার করে?,,,ডায়ালিসিস,சிறுநீரக டயாலிசிஸ் மெடிகேர் மூலம் சேர்க்கப்பட்டுள்ளதா?,,,டயாலிசிஸ்,మూత్రపిండాల డయలిసిస్ మెడికేర్ ద్వారా కవర్ చేయబడిందా?,,,మూత్రపిండాల డయలిసిస్,किडनी डायलिसीस हे औषधोपचारात समाविष्ट आहे का?,,,डायलिसीस,શું કિડની ડાયાલિસિસ મેડિકેર દ્વારા આવરી લેવામાં આવે છે?,,,ડાયાલિસિસ,other
i am currently 64. do i have to sign up for obamacare?,,,Obamacare,मैं वर्तमान में ६४ साल का हूं। क्या मुझे ओबमाकारे के लिए साइन अप करना चाहिए ?,,,ओबामाकेयर,বর্তমানে আমার বয়স ৬৪। আমাকে কি ওবামাকেয়ারের জন্য সাইন আপ করতে হবে?,,,ওবামাকেয়ার,"எனக்கு தற்போது வயது 64. நான் ""ஒபாமாகேர்"" இல் பதிவு செய்ய வேண்டுமா?",,,ஒபாமாகேர்,ప్రస్తుతం నా వయసు ౬౪ ఏళ్లు. నేను ఒబామాకేర్ కోసం సైన్ అప్ చేయాలా?,,,ఒబామాకేర్,मी सध्या ६४ वर्षांचा आहे. मला ओबामाकेअरसाठी साइन अप करावे लागेल का?,,,ओबामाकेअर,હું હાલમાં ૬૪ વર્ષનો છું. શું મારે ઓબામાકેર માટે સાઇન અપ કરવું પડશે?,,,ઓબામાકેર,other
if i have already had the flu this season should i get a flu shot?,flu,flu shot,,अगर मुझे पहले से ही इस मौसम में फ्लू था तो क्या मुझे एक फ्लू शॉट मिल जाना चाहिए?,फ्लू,फ्लू शॉट,,যদি আমি ইতিমধ্যে এই মৌসুমে ফ্লু হয়ে থাকে তবে আমার কি ফ্লু শট নেওয়া উচিত?,ফ্লু,ফ্লু শট,,நான் ஏற்கனவே இந்த பருவத்தில் காய்ச்சல் இருந்திருந்தால் நான் ஒரு காய்ச்சல் ஷாட் பெற வேண்டும்?,காய்ச்சல் ,காய்ச்சல் ஷாட்,,"ఈ ఋతువు లో నాకు ఇప్పటికే ఫ్లూ ఉన్నట్లయితే, నేను ఫ్లూ షాట్ పొందాలా?  ",ఫ్లూ,ఫ్లూ షాట్,,मला या हंगामात फ्लू झाला असेल तर मला फ्लूचा शॉट घ्यावा का?,फ्लू,फ्लूचा शॉट,,જો આ સિઝનમાં મને પહેલેથી જ ફ્લૂ થયો હોય તો શું મારે ફ્લૂનો શૉટ લેવો જોઈએ?,ફ્લૂ,ફલૂ શોટ,,other